{
  "schemaVersion": "0.1.0",
  "generatedAt": "2026-10-17T00:00:00.000Z",
  "tool": {
    "name": "teia",
    "version": "0.1.0"
  },
  "project": {
    "name": "ts-basic",
    "root": "/caminho/para/teia/fixtures/ts-basic",
    "languages": [
      "ts"
    ],
    "tsconfig": "tsconfig.json"
  },
  "analyzer": {
    "name": "@teia/analyzer (ts-morph)",
    "version": "0.1.0",
    "typescriptVersion": "6.0.2",
    "options": {
      "exclude": [],
      "respectGitignore": true,
      "maxFiles": 10000,
      "maxFileSizeBytes": 1000000
    }
  },
  "nodes": [
    {
      "id": "class:src/models/user.ts#BaseModel",
      "kind": "class",
      "name": "BaseModel",
      "qualifiedName": "BaseModel",
      "location": {
        "file": "src/models/user.ts",
        "startLine": 1,
        "startColumn": 1,
        "endLine": 5,
        "endColumn": 2
      },
      "meta": {
        "language": "ts",
        "exported": true,
        "defaultExport": false
      },
      "parent": "file:src/models/user.ts"
    },
    {
      "id": "class:src/models/user.ts#User",
      "kind": "class",
      "name": "User",
      "qualifiedName": "User",
      "location": {
        "file": "src/models/user.ts",
        "startLine": 7,
        "startColumn": 1,
        "endLine": 18,
        "endColumn": 2
      },
      "meta": {
        "language": "ts",
        "exported": true,
        "defaultExport": false
      },
      "parent": "file:src/models/user.ts"
    },
    {
      "id": "class:src/services/user-service.ts#UserService",
      "kind": "class",
      "name": "UserService",
      "qualifiedName": "UserService",
      "location": {
        "file": "src/services/user-service.ts",
        "startLine": 4,
        "startColumn": 1,
        "endLine": 34,
        "endColumn": 2
      },
      "meta": {
        "language": "ts",
        "exported": true,
        "defaultExport": false
      },
      "parent": "file:src/services/user-service.ts"
    },
    {
      "id": "file:src/cycle/a.ts",
      "kind": "file",
      "name": "a.ts",
      "qualifiedName": "src/cycle/a.ts",
      "parent": "module:src/cycle",
      "location": {
        "file": "src/cycle/a.ts",
        "startLine": 1,
        "startColumn": 1,
        "endLine": 6,
        "endColumn": 1
      },
      "meta": {
        "language": "ts",
        "lines": 6,
        "exportNames": [
          "ping"
        ],
        "inCycle": true
      }
    },
    {
      "id": "file:src/cycle/b.ts",
      "kind": "file",
      "name": "b.ts",
      "qualifiedName": "src/cycle/b.ts",
      "parent": "module:src/cycle",
      "location": {
        "file": "src/cycle/b.ts",
        "startLine": 1,
        "startColumn": 1,
        "endLine": 6,
        "endColumn": 1
      },
      "meta": {
        "language": "ts",
        "lines": 6,
        "exportNames": [
          "pong"
        ],
        "inCycle": true
      }
    },
    {
      "id": "file:src/index.ts",
      "kind": "file",
      "name": "index.ts",
      "qualifiedName": "src/index.ts",
      "parent": "module:src",
      "location": {
        "file": "src/index.ts",
        "startLine": 1,
        "startColumn": 1,
        "endLine": 29,
        "endColumn": 1
      },
      "meta": {
        "language": "ts",
        "lines": 29,
        "exportNames": [
          "main"
        ]
      }
    },
    {
      "id": "file:src/lib/index.ts",
      "kind": "file",
      "name": "index.ts",
      "qualifiedName": "src/lib/index.ts",
      "parent": "module:src/lib",
      "location": {
        "file": "src/lib/index.ts",
        "startLine": 1,
        "startColumn": 1,
        "endLine": 3,
        "endColumn": 1
      },
      "meta": {
        "language": "ts",
        "lines": 3,
        "exportNames": [
          "add",
          "slugify"
        ]
      }
    },
    {
      "id": "file:src/lib/strings.ts",
      "kind": "file",
      "name": "strings.ts",
      "qualifiedName": "src/lib/strings.ts",
      "parent": "module:src/lib",
      "location": {
        "file": "src/lib/strings.ts",
        "startLine": 1,
        "startColumn": 1,
        "endLine": 8,
        "endColumn": 1
      },
      "meta": {
        "language": "ts",
        "lines": 8,
        "exportNames": [
          "slugify"
        ]
      }
    },
    {
      "id": "file:src/math.ts",
      "kind": "file",
      "name": "math.ts",
      "qualifiedName": "src/math.ts",
      "parent": "module:src",
      "location": {
        "file": "src/math.ts",
        "startLine": 1,
        "startColumn": 1,
        "endLine": 15,
        "endColumn": 1
      },
      "meta": {
        "language": "ts",
        "lines": 15,
        "exportNames": [
          "average",
          "double",
          "sum"
        ]
      }
    },
    {
      "id": "file:src/models/user.ts",
      "kind": "file",
      "name": "user.ts",
      "qualifiedName": "src/models/user.ts",
      "parent": "module:src/models",
      "location": {
        "file": "src/models/user.ts",
        "startLine": 1,
        "startColumn": 1,
        "endLine": 19,
        "endColumn": 1
      },
      "meta": {
        "language": "ts",
        "lines": 19,
        "exportNames": [
          "BaseModel",
          "User"
        ]
      }
    },
    {
      "id": "file:src/services/user-service.ts",
      "kind": "file",
      "name": "user-service.ts",
      "qualifiedName": "src/services/user-service.ts",
      "parent": "module:src/services",
      "location": {
        "file": "src/services/user-service.ts",
        "startLine": 1,
        "startColumn": 1,
        "endLine": 35,
        "endColumn": 1
      },
      "meta": {
        "language": "ts",
        "lines": 35,
        "exportNames": [
          "UserService"
        ]
      }
    },
    {
      "id": "file:src/side-effect.ts",
      "kind": "file",
      "name": "side-effect.ts",
      "qualifiedName": "src/side-effect.ts",
      "parent": "module:src",
      "location": {
        "file": "src/side-effect.ts",
        "startLine": 1,
        "startColumn": 1,
        "endLine": 5,
        "endColumn": 1
      },
      "meta": {
        "language": "ts",
        "lines": 5
      }
    },
    {
      "id": "fn:src/cycle/a.ts#ping",
      "kind": "function",
      "name": "ping",
      "qualifiedName": "ping",
      "location": {
        "file": "src/cycle/a.ts",
        "startLine": 3,
        "startColumn": 1,
        "endLine": 5,
        "endColumn": 2
      },
      "meta": {
        "language": "ts",
        "exported": true,
        "defaultExport": false,
        "async": false
      },
      "parent": "file:src/cycle/a.ts"
    },
    {
      "id": "fn:src/cycle/b.ts#pong",
      "kind": "function",
      "name": "pong",
      "qualifiedName": "pong",
      "location": {
        "file": "src/cycle/b.ts",
        "startLine": 3,
        "startColumn": 1,
        "endLine": 5,
        "endColumn": 2
      },
      "meta": {
        "language": "ts",
        "exported": true,
        "defaultExport": false,
        "async": false
      },
      "parent": "file:src/cycle/b.ts"
    },
    {
      "id": "fn:src/index.ts#main",
      "kind": "function",
      "name": "main",
      "qualifiedName": "main",
      "location": {
        "file": "src/index.ts",
        "startLine": 11,
        "startColumn": 1,
        "endLine": 22,
        "endColumn": 2
      },
      "meta": {
        "language": "ts",
        "exported": true,
        "defaultExport": false,
        "async": false
      },
      "parent": "file:src/index.ts"
    },
    {
      "id": "fn:src/index.ts#runCallback",
      "kind": "function",
      "name": "runCallback",
      "qualifiedName": "runCallback",
      "location": {
        "file": "src/index.ts",
        "startLine": 24,
        "startColumn": 1,
        "endLine": 26,
        "endColumn": 2
      },
      "meta": {
        "language": "ts",
        "exported": false,
        "defaultExport": false,
        "async": false
      },
      "parent": "file:src/index.ts"
    },
    {
      "id": "fn:src/lib/strings.ts#normalize",
      "kind": "function",
      "name": "normalize",
      "qualifiedName": "normalize",
      "location": {
        "file": "src/lib/strings.ts",
        "startLine": 5,
        "startColumn": 1,
        "endLine": 7,
        "endColumn": 2
      },
      "meta": {
        "language": "ts",
        "exported": false,
        "defaultExport": false,
        "async": false
      },
      "parent": "file:src/lib/strings.ts"
    },
    {
      "id": "fn:src/lib/strings.ts#slugify",
      "kind": "function",
      "name": "slugify",
      "qualifiedName": "slugify",
      "location": {
        "file": "src/lib/strings.ts",
        "startLine": 1,
        "startColumn": 1,
        "endLine": 3,
        "endColumn": 2
      },
      "meta": {
        "language": "ts",
        "exported": true,
        "defaultExport": false,
        "async": false
      },
      "parent": "file:src/lib/strings.ts"
    },
    {
      "id": "fn:src/math.ts#average",
      "kind": "function",
      "name": "average",
      "qualifiedName": "average",
      "location": {
        "file": "src/math.ts",
        "startLine": 5,
        "startColumn": 1,
        "endLine": 8,
        "endColumn": 2
      },
      "meta": {
        "language": "ts",
        "exported": true,
        "defaultExport": false,
        "async": false
      },
      "parent": "file:src/math.ts"
    },
    {
      "id": "fn:src/math.ts#double",
      "kind": "function",
      "name": "double",
      "qualifiedName": "double",
      "location": {
        "file": "src/math.ts",
        "startLine": 10,
        "startColumn": 14,
        "endLine": 10,
        "endColumn": 60
      },
      "meta": {
        "language": "ts",
        "exported": true,
        "async": false
      },
      "parent": "file:src/math.ts"
    },
    {
      "id": "fn:src/math.ts#multiply",
      "kind": "function",
      "name": "multiply",